title,company,location,category,salary_min,salary_max,salary_predicted,description,redirect_url
Senior Data Engineer,Cardinal Health,"Dublin, Franklin County",IT Jobs,132892.1,132892.1,1,"_What Data Engineering contributes to Cardinal Health_ The Data & Analytics Function oversees the analytics life-cycle in order to identify, analyze and present relevant insights that drive business decisions and anticipate opportunities to achieve a competitive advantage. This function manages analytic data platforms, the access, design and implementation of reporting/business intelligence solutions, and the application of advanced quantitative modeling. Data Engineering ensures raw data is us…",https://www.adzuna.com/land/ad/5381727937?se=LG06dz2Z8BGPS-rNfttiFw&utm_medium=api&utm_source=a6e23083&v=ED09D433AC0E3661AC7ADB71EF4F787EF3D81571
Data Engineering Manager,HCA Healthcare,"Nashville, Davidson County",IT Jobs,120267.48,120267.48,1,"Description Introduction Are you passionate about the patient experience? At HCA Healthcare, we are committed to caring for patients with purpose and integrity. We care like family! Jump-start your career as a(an) Data Engineering Manager today with HCA Healthcare. Benefits HCA Healthcare offers a total rewards package that supports the health, life, career and retirement of our colleagues. The available plans and programs include:  Comprehensive medical coverage that covers many common service…",https://www.adzuna.com/land/ad/5411281623?se=LG06dz2Z8BGPS-rNfttiFw&utm_medium=api&utm_source=a6e23083&v=A9B38BBAC4BE15FA482065199DA03AD933DA8704
"Director, Data Engineering",Cargill,"Atlanta, Fulton County","Energy, Oil & Gas Jobs",267482.9,267482.9,1,"Cargill's size and scale allows us to make a positive impact in the world. Our purpose is to nourish the world in a safe, responsible and sustainable way. We are a family company providing food, ingredients, agricultural solutions and industrial products that are vital for living. We connect farmers with markets so they can prosper. We connect customers with ingredients so they can make meals people love. And we connect families with daily essentials - from eggs to edible oils, salt to skincare…",https://www.adzuna.com/land/ad/5190640593?se=LG06dz2Z8BGPS-rNfttiFw&utm_medium=api&utm_source=a6e23083&v=8F181EED5755E181F7F84A0806EB89DC3371959D
Data Engineer- Remote,Insight Global,"Grand Central, Manhattan",IT Jobs,125726.14,125726.14,1,"Job Description An employer is looking for a Data Engineer to join their team in remotely. This person will join the newly created ""brainchild"" of two well established private equity firmsthis new company will be focused on the annuities space of life insurance and is an AI Technology driven company. He/she will report to the Head of Data Engineering and will be responsible for designing, building, and maintaining the data infrastructure for the company's analytics, AI, and operational workflow…",https://www.adzuna.com/land/ad/5405701426?se=LG06dz2Z8BGPS-rNfttiFw&utm_medium=api&utm_source=a6e23083&v=60FE6FDF71994DA09D00AD91A8891B99E97444C2
Staff Data Engineer,HCA Healthcare,"Nashville, Davidson County",IT Jobs,124408.42,124408.42,1,"Description Introduction Experience the HCA Healthcare difference where colleagues are trusted, valued members of our healthcare team. Grow your career with an organization committed to delivering respectful, compassionate care, and where the unique and intrinsic worth of each individual is recognized. Submit your application for the opportunity below: Staff Data Engineer HCA Healthcare Benefits HCA Healthcare, offers a total rewards package that supports the health, life, career and retirement…",https://www.adzuna.com/land/ad/5391531953?se=LG06dz2Z8BGPS-rNfttiFw&utm_medium=api&utm_source=a6e23083&v=5E7FC5AC416DB5C84C5E5233B60CFA687665B6BA
REMOTE Data Engineer,Insight Global,"Beavercrk, Greene County",IT Jobs,82653.5,82653.5,1,"Job Description Insight Global is seeking a Data Engineer to join the team of one of their fastest growing government clients. This individual will be joining a team as a direct hire employee where they will be assisting in challenging data engineering, data management, and data analytics projects. There will be opportunity to collaborate with data scientists as well as other individuals within the IT team to deploy data services. This individual must be willing to learn quickly and be able to …",https://www.adzuna.com/land/ad/5401918748?se=BrvKeD2Z8BGtF-Yn1mIJCg&utm_medium=api&utm_source=a6e23083&v=7B066FBF1FF768555C4AF25C2C5A406F55D24B58
"Director, Data Engineering",Fiserv,"Alpharetta, Fulton County",IT Jobs,233081.67,233081.67,1,"Calling all innovators - find your future at Fiserv. We're Fiserv, a global leader in Fintech and payments, and we move money and information in a way that moves the world. We connect financial institutions, corporations, merchants and consumers to one another millions of times a day - quickly, reliably, and securely. Any time you swipe your credit card, pay through a mobile app, or withdraw money from the bank, we're involved. If you want to make an impact on a global scale, come make a differ…",https://www.adzuna.com/land/ad/5398349489?se=BrvKeD2Z8BGtF-Yn1mIJCg&utm_medium=api&utm_source=a6e23083&v=1C29DAA5FFEA59F48C48E935653CBAA186ADDB8E
"Director, Data Engineering",Fiserv,"Berkeley Heights, Union County",IT Jobs,204067.64,204067.64,1,"Calling all innovators - find your future at Fiserv. We're Fiserv, a global leader in Fintech and payments, and we move money and information in a way that moves the world. We connect financial institutions, corporations, merchants and consumers to one another millions of times a day - quickly, reliably, and securely. Any time you swipe your credit card, pay through a mobile app, or withdraw money from the bank, we're involved. If you want to make an impact on a global scale, come make a differ…",https://www.adzuna.com/land/ad/5398349249?se=BrvKeD2Z8BGtF-Yn1mIJCg&utm_medium=api&utm_source=a6e23083&v=35ACC5E0417B3B25DCC0AF40ED02C4509427DDFF
Remote Data Engineer,Insight Global,"West Slope, Washington County",IT Jobs,78103.86,78103.86,1,"Job Description This candidate can be fully remote but must work PST hours (9am-4pm) The Data Engineer helps design, build, and maintain the systems that process and store data. The ideal candidate will have a background in data engineering, with experience in building data pipelines and solutions that support business needs. You will play an important role in architecting and implementing data solutions that drive innovation and improve business outcomes. This requires a solid understanding of…",https://www.adzuna.com/land/ad/5372700781?se=BrvKeD2Z8BGtF-Yn1mIJCg&utm_medium=api&utm_source=a6e23083&v=4E8B19674AF8C6BEE85416CC572DA3D36D32C2EF
"Director, Data Engineering",PRGX,"Atlanta, Fulton County",IT Jobs,145095.31,145095.31,1,"About PRGX Global, Inc Job Description Job Title Director, Data Engineering Employment Type Full-time Work Authorization Requirements Authorized to work in the United States without sponsorship Language Requirements English About PRGX PRGX is the global leader in source-to-pay data analytics and software, and tech-enabled profit recovery services. We provide software and services to maximize revenue recovery and drive margin improvement for our clients. For more information about PRGX, visit ww…",https://www.adzuna.com/land/ad/5323939901?se=BrvKeD2Z8BGtF-Yn1mIJCg&utm_medium=api&utm_source=a6e23083&v=200DF29AE784311C2FF8C7598E79F0227EB6FD2B
Director Data Engineering,The Hartford,"Talcott Village, Hartford County",IT Jobs,231362.67,231362.67,1,"Dir Data Engineering - GE06AE We're determined to make a difference and are proud to be an insurance company that goes well beyond coverages and policies. Working here means having every opportunity to achieve your goals - and to help others accomplish theirs, too. Join our team as we help shape the future. We are seeking a highly experienced Director of Engineering to lead our engineering team in developing and maintaining our finance applications. The team supports various finance application…",https://www.adzuna.com/land/ad/5244792077?se=BrvKeD2Z8BGtF-Yn1mIJCg&utm_medium=api&utm_source=a6e23083&v=CE0C7A51199E947E532FAFCEB697978DCA923C07
Data Engineer - SME,SOS International LLC,"Redstone Arsenal, Madison County",IT Jobs,166948.11,166948.11,1,"Overview SOSi is seeking an expert Data Engineer to join our analytics team working on an innovative MLOps workload leveraging cutting-edge technologies and supporting a government customer in Huntsville, Alabama. This role will be responsible for delivering automation to key national security missions interacting with petabyte-scale data on supercomputing resources. In this role, you will construct data analytical infrastructure, data engineering, data mining, exploratory analysis, predictive …",https://www.adzuna.com/land/ad/5104853579?se=BrvKeD2Z8BGtF-Yn1mIJCg&utm_medium=api&utm_source=a6e23083&v=77A559DD73A26BB627F3F35EF9D63B712174347B
Lead Data Engineer,Mastercard,"Weldon Spring, Saint Charles County",IT Jobs,161562.47,161562.47,1,"Our Purpose _Mastercard powers economies and empowers people in 200 countries and territories worldwide. Together with our customers, we're helping build a sustainable economy where everyone can prosper. We support a wide range of digital payments choices, making transactions secure, simple, smart and accessible. Our technology and innovation, partnerships and networks combine to deliver a unique set of products and services that help people, businesses and governments realize their greatest po…",https://www.adzuna.com/land/ad/5383929677?se=BrvKeD2Z8BGtF-Yn1mIJCg&utm_medium=api&utm_source=a6e23083&v=87C92731753B965579EA71A447A7777A672B8B51
Lead Data Engineer,WestRock Company,"Atlanta, Fulton County",IT Jobs,148027.34,148027.34,1,"Our technology organization is transforming how we work at WestRock. We align with our businesses to deliver innovative solutions that: * Address specific business challenges, integrate processes, and create great experiences * Connect our work to shared goals that propel WestRock forward in the Digital Age * Imagine how technology can advance the way we work by using disruptive technology We are looking for forward thinking technologists that can accelerate our focus areas such as building str…",https://www.adzuna.com/land/ad/5402242130?se=BrvKeD2Z8BGtF-Yn1mIJCg&utm_medium=api&utm_source=a6e23083&v=F355FF3AAFC8288A70AD437E03F6079320F39058
Staff Data Engineer,NBC Universal,"Englewood Cliffs, Bergen County",IT Jobs,74760.71,74760.71,1,"NBCUniversal is one of the world's leading media and entertainment companies. We create world-class content, which we distribute across our portfolio of film, television, and streaming, and bring to life through our theme parks and consumer experiences. We own and operate leading entertainment and news brands, including NBC, NBC News, MSNBC, CNBC, NBC Sports, Telemundo, NBC Local Stations, Bravo, USA Network, and Peacock, our premium ad-supported streaming service. We produce and distribute pre…",https://www.adzuna.com/land/ad/5292578603?se=BrvKeD2Z8BGtF-Yn1mIJCg&utm_medium=api&utm_source=a6e23083&v=B105859F483DA9AF91BCB2313775F49B8BDD0647
Sr. Data Engineer,Insight Global,"Castlewood, Centennial",IT Jobs,149154.06,149154.06,1,"Job Description Senior Data Engineer Client of Insight Global | Long-term Opportunity | AWS Transformation Project Duration: 6 month contract with likely extension and possible conversion Location: Fully remote in Colorado, Minneapolis, or Minnesota Insight Global is supporting a client that is going through a large-scale data transformation. We're looking for a Senior Data Engineer with strong hands-on experience building scalable, cloud-native data platforms in AWS. This is a software enginee…",https://www.adzuna.com/land/ad/5410076928?se=BrvKeD2Z8BGtF-Yn1mIJCg&utm_medium=api&utm_source=a6e23083&v=EDEF1FC6C2264B0E8DB93B9575D9DD6E3D4B98FA
Lead Data Engineer,CVS Health,"Woonsocket, Providence County",IT Jobs,111298.95,111298.95,1,"At CVS Health, we're building a world of health around every consumer and surrounding ourselves with dedicated colleagues who are passionate about transforming health care. As the nation's leading health solutions company, we reach millions of Americans through our local presence, digital channels and more than 300,000 purpose-driven colleagues - caring for people where, when and how they choose in a way that is uniquely more connected, more convenient and more compassionate. And we do it all w…",https://www.adzuna.com/land/ad/5375810912?se=BrvKeD2Z8BGtF-Yn1mIJCg&utm_medium=api&utm_source=a6e23083&v=86FD0A7DC7E785375060F181E6D09E7B552414A2
Remote Data Engineer,Insight Global,"Saint Bernard, Hamilton County",IT Jobs,121770.24,121770.24,1,"Job Description Insight Global is hiring Data Engineers for a contract opportunity supporting our largest financial client in the Cincinnati, Ohio area. Although all-star candidates may have remote consideration, there is a strong preference is to have these individuals' hybrid onsite in Cincinnati at their downtown location. These Data Engineers will be integral to the migration & modernization efforts from the company's legacy DB2 systems to Snowflake data warehouse to be ingested by the new …",https://www.adzuna.com/land/ad/5398010017?se=BrvKeD2Z8BGtF-Yn1mIJCg&utm_medium=api&utm_source=a6e23083&v=9F3DF5BDB2CCAB22308A08A0D8FF70BA0BB4BD44
Azure Data Engineer,System One,"Wellston, Saint Louis County",IT Jobs,129621.77,129621.77,1,"System One is seeking an Azure Data Engineer (ERP) for a long-term opportunity in St. Louis, MO. The Data Engineer will lead and implement data engineering projects that integrate data from multiple ERP systems into both operational and analytical platforms. This role combines hands-on pipeline development, data modeling, and reporting enablement using Microsoft Azure, Synapse, Power BI and Fabric. Responsibilities  Develop, maintain, and optimize data pipelines from D365 Finance & Operations u…",https://www.adzuna.com/land/ad/5398348341?se=BrvKeD2Z8BGtF-Yn1mIJCg&utm_medium=api&utm_source=a6e23083&v=D2FE4D6DF7C6D48AB7B9DB8BFBF4E7B316D0D92B
"Consultant, Data Engineering",IBM,"Phoenix, Maricopa County",IT Jobs,87259.21,87259.21,1,"Introduction At IBM, work is more than a job - it's a calling: To build. To design. To code. To consult. To think along with clients and sell. To make markets. To invent. To collaborate. Not just to do something better, but to attempt things you've never thought possible. Are you ready to lead in this new era of technology and solve some of the world's most challenging problems? If so, lets talk. Your role and responsibilities At Hakkoda, a Data Engineer Consultant will work in the design and d…",https://www.adzuna.com/land/ad/5369606009?se=BrvKeD2Z8BGtF-Yn1mIJCg&utm_medium=api&utm_source=a6e23083&v=22774647203042A7126ACCE4D9DDBFA70072030D
Senior Data Engineer,Fiserv,"Alpharetta, Fulton County",IT Jobs,166396.23,166396.23,1,"Calling all innovators - find your future at Fiserv. We're Fiserv, a global leader in Fintech and payments, and we move money and information in a way that moves the world. We connect financial institutions, corporations, merchants, and consumers to one another millions of times a day - quickly, reliably, and securely. Any time you swipe your credit card, pay through a mobile app, or withdraw money from the bank, we're involved. If you want to make an impact on a global scale, come make a diffe…",https://www.adzuna.com/land/ad/5398348754?se=BrvKeD2Z8BGtF-Yn1mIJCg&utm_medium=api&utm_source=a6e23083&v=CC76162E8E4DFF3E6F2F04DC45D5676711EBF696
AWS Data Engineer,Robert Half,"Atlanta, Fulton County",IT Jobs,154408.69,154408.69,1,"Description We are looking for an AWS Data Engineer to join our team based in Seattle, WA. This is a long-term contract position where you will play a key role in overseeing complex engineering projects, guiding technical teams, and ensuring the successful integration and maintenance of software systems. The ideal candidate will bring extensive experience in system planning, design, and execution, as well as a strong ability to lead and collaborate across functional areas. Responsibilities: · I…",https://www.adzuna.com/land/ad/5409149162?se=BrvKeD2Z8BGtF-Yn1mIJCg&utm_medium=api&utm_source=a6e23083&v=5873AAA0C57297136586684F55BBA3CC6E470951
Databricks Data Engineer,Leidos,"Washington, D.C., US",IT Jobs,127606.21,127606.21,1,"Description Leidos is seeking a Databricks Data Engineer to develop/support new/existing data pipelines, and data analytics environments in Azure cloud-based data lake. As a data engineer, you will translate business requirements to data engineering solutions to support an enterprise scale Microsoft Azure based data analytics platform. You will support continued maintenance of ETL operations and development of new pipelines ensuring data quality and data management. The ideal candidate will bri…",https://www.adzuna.com/land/ad/5413077283?se=BrvKeD2Z8BGtF-Yn1mIJCg&utm_medium=api&utm_source=a6e23083&v=B340CEF4E2209108C114922DBC81C6EB3C60BC35
Databricks Data Engineer,Leidos,"Uptown, Marion County",IT Jobs,153669.77,153669.77,1,"Description Leidos is seeking a Databricks Data Engineer to develop/support new/existing data pipelines, and data analytics environments in Azure cloud-based data lake. As a data engineer, you will translate business requirements to data engineering solutions to support an enterprise scale Microsoft Azure based data analytics platform. You will support continued maintenance of ETL operations and development of new pipelines ensuring data quality and data management. The ideal candidate will bri…",https://www.adzuna.com/land/ad/5412554155?se=BrvKeD2Z8BGtF-Yn1mIJCg&utm_medium=api&utm_source=a6e23083&v=8E13A74CAEC4426E0A1EF82470F9789CF470F7B4
"Director, Data Engineering",Travelers Insurance Company,"Talcott Village, Hartford County",Engineering Jobs,145989.6,145989.6,1,"Who Are We? Taking care of our customers, our communities and each other. That's the Travelers Promise. By honoring this commitment, we have maintained our reputation as one of the best property casualty insurers in the industry for over 160 years. Join us to discover a culture that is rooted in innovation and thrives on collaboration. Imagine loving what you do and where you do it. Job Category Technology Compensation Overview The annual base salary range provided for this position is a nation…",https://www.adzuna.com/land/ad/5410083787?se=BrvKeD2Z8BGtF-Yn1mIJCg&utm_medium=api&utm_source=a6e23083&v=1766EE440E1ECE24230E7C1E7451B90AA001614E
Senior Data Engineer,CAI,"Wilmington, New Castle County",IT Jobs,101239.26,101239.26,1,"Senior Data Engineer Req number: R6111 Employment type: Full time Worksite flexibility: Hybrid Who we are CAI is a global technology services firm with over 8,500 associates worldwide and a yearly revenue of $1 billion. We have over 40 years of excellence in uniting talent and technology to power the possible for our clients, colleagues, and communities. As a privately held company, we have the freedom and focus to do what is right-whatever it takes. Our tailor-made solutions create lasting res…",https://www.adzuna.com/land/ad/5382105600?se=BrvKeD2Z8BGtF-Yn1mIJCg&utm_medium=api&utm_source=a6e23083&v=574341BBF2D84F3B9FF304250BE2CC264DB02CE3
Senior Data Engineer,SHI,"Bismarck, Burleigh County",IT Jobs,122792.5,122792.5,1,"About Us Since 1989, SHI International Corp. has helped organizations change the world through technology. We've grown every year since, and today we're proud to be a $15 billion global provider of IT solutions and services. Over 17,000 organizations worldwide rely on SHI's concierge approach to help them solve what's next. But the heartbeat of SHI is our employees - all 6,000 of them. If you join our team, you'll enjoy:  Our commitment to diversity, as the largest minority- and woman-owned ent…",https://www.adzuna.com/land/ad/5349795104?se=BrvKeD2Z8BGtF-Yn1mIJCg&utm_medium=api&utm_source=a6e23083&v=CD6A384D44F7E668139C10E233939167861A51A1
Senior Data Engineer,SHI,"Annapolis, Anne Arundel County",IT Jobs,212172.48,212172.48,1,"About Us Since 1989, SHI International Corp. has helped organizations change the world through technology. We've grown every year since, and today we're proud to be a $15 billion global provider of IT solutions and services. Over 17,000 organizations worldwide rely on SHI's concierge approach to help them solve what's next. But the heartbeat of SHI is our employees - all 6,000 of them. If you join our team, you'll enjoy:  Our commitment to diversity, as the largest minority- and woman-owned ent…",https://www.adzuna.com/land/ad/5350447065?se=BrvKeD2Z8BGtF-Yn1mIJCg&utm_medium=api&utm_source=a6e23083&v=7867F4873BA1D26BACE4C2C05D9893997437BEDC
Senior Data Engineer,SHI,"Grandview Heights, Franklin County",IT Jobs,213355.64,213355.64,1,"About Us Since 1989, SHI International Corp. has helped organizations change the world through technology. We've grown every year since, and today we're proud to be a $15 billion global provider of IT solutions and services. Over 17,000 organizations worldwide rely on SHI's concierge approach to help them solve what's next. But the heartbeat of SHI is our employees - all 6,000 of them. If you join our team, you'll enjoy:  Our commitment to diversity, as the largest minority- and woman-owned ent…",https://www.adzuna.com/land/ad/5349569509?se=BrvKeD2Z8BGtF-Yn1mIJCg&utm_medium=api&utm_source=a6e23083&v=4B3B30C55F71BBAA2FD867FF32F5D7AACF2C8C9C
Senior Data Engineer,SHI,"Augusta, Kennebec County",IT Jobs,231685.48,231685.48,1,"About Us Since 1989, SHI International Corp. has helped organizations change the world through technology. We've grown every year since, and today we're proud to be a $15 billion global provider of IT solutions and services. Over 17,000 organizations worldwide rely on SHI's concierge approach to help them solve what's next. But the heartbeat of SHI is our employees - all 6,000 of them. If you join our team, you'll enjoy:  Our commitment to diversity, as the largest minority- and woman-owned ent…",https://www.adzuna.com/land/ad/5349479745?se=BrvKeD2Z8BGtF-Yn1mIJCg&utm_medium=api&utm_source=a6e23083&v=B193154C75CD2DD398C5F0A6972A8E953ECAB3B0
Senior Data Engineer,SHI,"Helena, Lewis and Clark County",IT Jobs,176052.4,176052.4,1,"About Us Since 1989, SHI International Corp. has helped organizations change the world through technology. We've grown every year since, and today we're proud to be a $15 billion global provider of IT solutions and services. Over 17,000 organizations worldwide rely on SHI's concierge approach to help them solve what's next. But the heartbeat of SHI is our employees - all 6,000 of them. If you join our team, you'll enjoy:  Our commitment to diversity, as the largest minority- and woman-owned ent…",https://www.adzuna.com/land/ad/5349485927?se=BrvKeD2Z8BGtF-Yn1mIJCg&utm_medium=api&utm_source=a6e23083&v=4DD28DDF00C18F656804077C16FD773FC3D95AA5
Senior Data Engineer,SHI,"Ny State Campus, Albany County",IT Jobs,193680.55,193680.55,1,"About Us Since 1989, SHI International Corp. has helped organizations change the world through technology. We've grown every year since, and today we're proud to be a $15 billion global provider of IT solutions and services. Over 17,000 organizations worldwide rely on SHI's concierge approach to help them solve what's next. But the heartbeat of SHI is our employees - all 6,000 of them. If you join our team, you'll enjoy:  Our commitment to diversity, as the largest minority- and woman-owned ent…",https://www.adzuna.com/land/ad/5349592183?se=BrvKeD2Z8BGtF-Yn1mIJCg&utm_medium=api&utm_source=a6e23083&v=F191420D7D4BFB60424B4B207ADE69FDA33EEA75
Senior Data Engineer,SHI,"Five Points, Wake County",IT Jobs,192936.88,192936.88,1,"About Us Since 1989, SHI International Corp. has helped organizations change the world through technology. We've grown every year since, and today we're proud to be a $15 billion global provider of IT solutions and services. Over 17,000 organizations worldwide rely on SHI's concierge approach to help them solve what's next. But the heartbeat of SHI is our employees - all 6,000 of them. If you join our team, you'll enjoy:  Our commitment to diversity, as the largest minority- and woman-owned ent…",https://www.adzuna.com/land/ad/5349555998?se=BrvKeD2Z8BGtF-Yn1mIJCg&utm_medium=api&utm_source=a6e23083&v=D8CC75FFEBD6AB52168B6030DB216D5F6D31CC0C
Senior Data Engineer,SHI,"Bonnie, Utah County",IT Jobs,177585.89,177585.89,1,"About Us Since 1989, SHI International Corp. has helped organizations change the world through technology. We've grown every year since, and today we're proud to be a $15 billion global provider of IT solutions and services. Over 17,000 organizations worldwide rely on SHI's concierge approach to help them solve what's next. But the heartbeat of SHI is our employees - all 6,000 of them. If you join our team, you'll enjoy:  Our commitment to diversity, as the largest minority- and woman-owned ent…",https://www.adzuna.com/land/ad/5349754725?se=BrvKeD2Z8BGtF-Yn1mIJCg&utm_medium=api&utm_source=a6e23083&v=3E33458F57260FD3C10E7F0F2096BCDE1F41958B
